{
  "$schema":"ubuddy-cp-rir-d2-canonical-suite-v0.schema.json",
  "schemaVersion":"cp-rir/d2-canonical-suite-input/v0",
  "status":"illustrative_v0_draft",
  "observerContract":{"solverVisible":["caseAlias","canonicalPayload"],"comparatorPrivate":["expectedDisposition","mutationClass"],"auditOnly":["credentialSecrets","signingKeys","rawReceiptEvidence"]},
  "cases":[
    {"caseAlias":"7Q2P9K4M","horizon":1,"concrete":{"stateIds":["c0","c1"],"initialStateId":"c0","terminalStateIds":["c1"],"badStateIds":[],"transitions":[{"from":"c0","event":"E1","to":"c1","eventClass":"MEDIATED_EFFECT","effect":{"effectId":"e1","sinkId":"s1","resourceId":"r1","multiplicity":1,"versionDelta":1}}]},"abstract":{"stateIds":["a0","a1"],"initialStateId":"a0","terminalStateIds":["a1"],"badStateIds":[],"transitions":[{"from":"a0","event":"A1","to":"a1","eventClass":"MEDIATED_EFFECT","effect":{"effectId":"e1","sinkId":"s1","resourceId":"r1","multiplicity":1,"versionDelta":1}}]},"mapping":{"stateMap":[{"from":"c0","to":"a0"},{"from":"c1","to":"a1"}],"eventMap":[{"from":"E1","to":"A1"}]},"monitor":{"stateIds":["m0","m1"],"initialStateId":"m0","violationStateIds":[],"terminalClosureStateIds":["m1"],"rules":[{"from":"m0","event":"A1","to":"m1"}]},"fault":{"stateIds":["f0"],"initialStateId":"f0","faultEventIds":[],"transitions":[]},"trace":{"concreteEvents":[{"from":"c0","event":"E1","to":"c1","eventClass":"MEDIATED_EFFECT","effect":{"effectId":"e1","sinkId":"s1","resourceId":"r1","multiplicity":1,"versionDelta":1}}],"abstractEvents":[{"from":"a0","event":"A1","to":"a1","eventClass":"MEDIATED_EFFECT","effect":{"effectId":"e1","sinkId":"s1","resourceId":"r1","multiplicity":1,"versionDelta":1}}]},"evidence":{"attestationVerification":"NOT_IMPLEMENTED","receiptVerification":"NOT_IMPLEMENTED","recoveryVerification":"NOT_IMPLEMENTED"}},
    {"caseAlias":"4L8M2X6C","horizon":1,"concrete":{"stateIds":["c0","cb"],"initialStateId":"c0","terminalStateIds":["cb"],"badStateIds":["cb"],"transitions":[{"from":"c0","event":"E2","to":"cb","eventClass":"UNMEDIATED_EFFECT","effect":{"effectId":"e2","sinkId":"s1","resourceId":"r1","multiplicity":1,"versionDelta":1}}]},"abstract":{"stateIds":["a0","ab"],"initialStateId":"a0","terminalStateIds":["ab"],"badStateIds":["ab"],"transitions":[{"from":"a0","event":"A2","to":"ab","eventClass":"UNMEDIATED_EFFECT","effect":{"effectId":"e2","sinkId":"s1","resourceId":"r1","multiplicity":1,"versionDelta":1}}]},"mapping":{"stateMap":[{"from":"c0","to":"a0"},{"from":"cb","to":"ab"}],"eventMap":[{"from":"E2","to":"A2"}]},"monitor":{"stateIds":["m0","mv"],"initialStateId":"m0","violationStateIds":["mv"],"terminalClosureStateIds":[],"rules":[{"from":"m0","event":"A2","to":"mv"}]},"fault":{"stateIds":["f0","fv"],"initialStateId":"f0","faultEventIds":["E2"],"transitions":[{"from":"f0","event":"E2","to":"fv"}]},"trace":{"concreteEvents":[{"from":"c0","event":"E2","to":"cb","eventClass":"UNMEDIATED_EFFECT","effect":{"effectId":"e2","sinkId":"s1","resourceId":"r1","multiplicity":1,"versionDelta":1}}],"abstractEvents":[{"from":"a0","event":"A2","to":"ab","eventClass":"UNMEDIATED_EFFECT","effect":{"effectId":"e2","sinkId":"s1","resourceId":"r1","multiplicity":1,"versionDelta":1}}]},"evidence":{"attestationVerification":"NOT_IMPLEMENTED","receiptVerification":"NOT_IMPLEMENTED","recoveryVerification":"NOT_IMPLEMENTED"}},
    {"caseAlias":"9R3K7V1N","horizon":1,"concrete":{"stateIds":["c0","cb"],"initialStateId":"c0","terminalStateIds":["cb"],"badStateIds":["cb"],"transitions":[{"from":"c0","event":"E3","to":"cb","eventClass":"MEDIATED_EFFECT","effect":{"effectId":"e3","sinkId":"s1","resourceId":"r1","multiplicity":1,"versionDelta":1}}]},"abstract":{"stateIds":["a0","a1"],"initialStateId":"a0","terminalStateIds":["a1"],"badStateIds":[],"transitions":[{"from":"a0","event":"A3","to":"a1","eventClass":"MEDIATED_EFFECT","effect":{"effectId":"e3","sinkId":"s1","resourceId":"r1","multiplicity":1,"versionDelta":1}}]},"mapping":{"stateMap":[{"from":"c0","to":"a0"},{"from":"cb","to":"a1"}],"eventMap":[{"from":"E3","to":"A3"}]},"monitor":{"stateIds":["m0","m1"],"initialStateId":"m0","violationStateIds":[],"terminalClosureStateIds":["m1"],"rules":[{"from":"m0","event":"A3","to":"m1"}]},"fault":{"stateIds":["f0"],"initialStateId":"f0","faultEventIds":[],"transitions":[]},"trace":{"concreteEvents":[{"from":"c0","event":"E3","to":"cb","eventClass":"MEDIATED_EFFECT","effect":{"effectId":"e3","sinkId":"s1","resourceId":"r1","multiplicity":1,"versionDelta":1}}],"abstractEvents":[{"from":"a0","event":"A3","to":"a1","eventClass":"MEDIATED_EFFECT","effect":{"effectId":"e3","sinkId":"s1","resourceId":"r1","multiplicity":1,"versionDelta":1}}]},"evidence":{"attestationVerification":"NOT_IMPLEMENTED","receiptVerification":"NOT_IMPLEMENTED","recoveryVerification":"NOT_IMPLEMENTED"}},
    {"caseAlias":"2V6N8B4H","horizon":1,"concrete":{"stateIds":["c0","cb"],"initialStateId":"c0","terminalStateIds":["cb"],"badStateIds":["cb"],"transitions":[{"from":"c0","event":"E4","to":"cb","eventClass":"UNMEDIATED_EFFECT","effect":{"effectId":"e4","sinkId":"s1","resourceId":"r1","multiplicity":1,"versionDelta":1}}]},"abstract":{"stateIds":["a0","a1"],"initialStateId":"a0","terminalStateIds":["a1"],"badStateIds":[],"transitions":[{"from":"a0","event":"A4","to":"a1","eventClass":"STUTTER","effect":{"effectId":null,"sinkId":null,"resourceId":null,"multiplicity":0,"versionDelta":0}}]},"mapping":{"stateMap":[{"from":"c0","to":"a0"},{"from":"cb","to":"a1"}],"eventMap":[{"from":"E4","to":"A4"}]},"monitor":{"stateIds":["m0","m1"],"initialStateId":"m0","violationStateIds":[],"terminalClosureStateIds":["m1"],"rules":[{"from":"m0","event":"A4","to":"m1"}]},"fault":{"stateIds":["f0"],"initialStateId":"f0","faultEventIds":[],"transitions":[]},"trace":{"concreteEvents":[{"from":"c0","event":"E4","to":"cb","eventClass":"UNMEDIATED_EFFECT","effect":{"effectId":"e4","sinkId":"s1","resourceId":"r1","multiplicity":1,"versionDelta":1}}],"abstractEvents":[{"from":"a0","event":"A4","to":"a1","eventClass":"STUTTER","effect":{"effectId":null,"sinkId":null,"resourceId":null,"multiplicity":0,"versionDelta":0}}]},"evidence":{"attestationVerification":"NOT_IMPLEMENTED","receiptVerification":"NOT_IMPLEMENTED","recoveryVerification":"NOT_IMPLEMENTED"}},
    {"caseAlias":"5D1T3J7S","horizon":1,"concrete":{"stateIds":["c0","cb"],"initialStateId":"c0","terminalStateIds":["cb"],"badStateIds":["cb"],"transitions":[{"from":"c0","event":"E5","to":"cb","eventClass":"UNMEDIATED_EFFECT","effect":{"effectId":"e5","sinkId":"s1","resourceId":"r1","multiplicity":1,"versionDelta":1}}]},"abstract":{"stateIds":["a0","a1"],"initialStateId":"a0","terminalStateIds":["a1"],"badStateIds":[],"transitions":[{"from":"a0","event":"A5","to":"a1","eventClass":"INTERNAL","effect":{"effectId":null,"sinkId":null,"resourceId":null,"multiplicity":0,"versionDelta":0}}]},"mapping":{"stateMap":[{"from":"c0","to":"a0"},{"from":"cb","to":"a1"}],"eventMap":[{"from":"E5","to":"A5"}]},"monitor":{"stateIds":["m0","m1"],"initialStateId":"m0","violationStateIds":[],"terminalClosureStateIds":["m1"],"rules":[{"from":"m0","event":"A5","to":"m1"}]},"fault":{"stateIds":["f0"],"initialStateId":"f0","faultEventIds":[],"transitions":[]},"trace":{"concreteEvents":[{"from":"c0","event":"E5","to":"cb","eventClass":"UNMEDIATED_EFFECT","effect":{"effectId":"e5","sinkId":"s1","resourceId":"r1","multiplicity":1,"versionDelta":1}}],"abstractEvents":[{"from":"a0","event":"A5","to":"a1","eventClass":"INTERNAL","effect":{"effectId":null,"sinkId":null,"resourceId":null,"multiplicity":0,"versionDelta":0}}]},"evidence":{"attestationVerification":"NOT_IMPLEMENTED","receiptVerification":"NOT_IMPLEMENTED","recoveryVerification":"NOT_IMPLEMENTED"}},
    {"caseAlias":"6C4W8F2Y","horizon":1,"concrete":{"stateIds":["c0","c1"],"initialStateId":"c0","terminalStateIds":["c1"],"badStateIds":[],"transitions":[{"from":"c0","event":"E6","to":"c1","eventClass":"INTERNAL","effect":{"effectId":null,"sinkId":null,"resourceId":null,"multiplicity":0,"versionDelta":0}}]},"abstract":{"stateIds":["a0","a1"],"initialStateId":"a0","terminalStateIds":["a1"],"badStateIds":[],"transitions":[{"from":"a0","event":"A6","to":"a1","eventClass":"INTERNAL","effect":{"effectId":null,"sinkId":null,"resourceId":null,"multiplicity":0,"versionDelta":0}}]},"mapping":{"stateMap":[{"from":"c0","to":"a0"},{"from":"c1","to":"a1"}],"eventMap":[{"from":"E6","to":"A6"}]},"monitor":{"stateIds":["m0","m1"],"initialStateId":"m0","violationStateIds":[],"terminalClosureStateIds":["m1"],"rules":[{"from":"m0","event":"A6","to":"m1"}]},"fault":{"stateIds":["f0"],"initialStateId":"f0","faultEventIds":[],"transitions":[]},"trace":{"concreteEvents":[{"from":"c0","event":"E6","to":"c1","eventClass":"INTERNAL","effect":{"effectId":null,"sinkId":null,"resourceId":null,"multiplicity":0,"versionDelta":0}}],"abstractEvents":[{"from":"a0","event":"A6_TAMPERED","to":"a1","eventClass":"INTERNAL","effect":{"effectId":null,"sinkId":null,"resourceId":null,"multiplicity":0,"versionDelta":0}}]},"evidence":{"attestationVerification":"NOT_IMPLEMENTED","receiptVerification":"NOT_IMPLEMENTED","recoveryVerification":"NOT_IMPLEMENTED"}}
  ],
  "implementationStatus":"prototype/unverified"
}
